{
  "$schema": "https://json-schema.org/draft/2020-12/schema",
  "$id": "https://torusai.io/schemas/library-config.schema.json",
  "$comment": "Previously https://torus.dev/schemas/library-config.schema.json. Renamespaced 2026-09-01 to the canonical torusai.io namespace. Nothing resolves schemas by $id \u2014 every validator loads by file path \u2014 so the change is declarative. Enforced by torus-multibuild lib/namespace.mjs.",
  "title": "Library instance configuration",
  "description": "Configuration for one institutional-archive instance. The engine reads this and holds no knowledge of any specific organisation.",
  "type": "object",
  "additionalProperties": false,
  "required": [
    "id_prefix",
    "organisation",
    "type_codes",
    "audiences",
    "paths"
  ],
  "properties": {
    "id_prefix": {
      "type": "string",
      "pattern": "^[A-Z][A-Z0-9]{1,7}$",
      "description": "Prefix for every document ID in this instance, e.g. 'TL' for Torus Library. A third-party instance sets its own."
    },
    "organisation": {
      "type": "object",
      "additionalProperties": false,
      "required": [
        "name"
      ],
      "properties": {
        "name": {
          "type": "string",
          "minLength": 1
        },
        "imprint": {
          "type": "string"
        }
      }
    },
    "type_codes": {
      "type": "object",
      "minProperties": 1,
      "additionalProperties": {
        "type": "string",
        "minLength": 1
      },
      "propertyNames": {
        "pattern": "^[A-Z]{3}$"
      },
      "description": "Map of three-letter document type code to human label."
    },
    "audiences": {
      "type": "array",
      "minItems": 1,
      "uniqueItems": true,
      "items": {
        "type": "string",
        "minLength": 1
      },
      "description": "Every audience this instance recognises. Order is not significance."
    },
    "public_audience": {
      "type": "string",
      "description": "The single audience value treated as publicly releasable. If omitted, NO audience is publishable and every public export fails closed."
    },
    "diligence_categories": {
      "type": "array",
      "items": {
        "type": "string",
        "minLength": 1
      },
      "description": "Instance diligence taxonomy. Omitted means the engine default is used."
    },
    "classifications": {
      "type": "array",
      "items": {
        "type": "string",
        "minLength": 1
      },
      "description": "Sensitivity vocabulary for restricted references."
    },
    "paths": {
      "type": "object",
      "additionalProperties": false,
      "required": [
        "papers",
        "canon",
        "manifest"
      ],
      "properties": {
        "papers": {
          "type": "string",
          "minLength": 1
        },
        "canon": {
          "type": "string",
          "minLength": 1
        },
        "manifest": {
          "type": "string",
          "minLength": 1
        },
        "public_export": {
          "type": "string",
          "minLength": 1
        },
        "references": {
          "type": "string",
          "minLength": 1
        },
        "exports": {
          "type": "string",
          "minLength": 1
        }
      }
    },
    "pdf": {
      "type": "object",
      "additionalProperties": false,
      "properties": {
        "renderer": {
          "type": "string",
          "enum": [
            "chromium"
          ]
        },
        "binary": {
          "type": "string",
          "description": "Absolute path to a Chrome/Chromium binary. If omitted the engine searches standard locations and the CHROMIUM_BINARY environment variable."
        },
        "footer_note": {
          "type": "string"
        }
      }
    }
  }
}
